MBTI Indicator,Major Cluster (Related Fields),GPA Weight,Satisfaction Weight,Feature DescriptionI (Introversion),"Basic Sciences, Programming, Accounting",0.75,0.4,Independent research and deep focus capabilityE (Extraversion),"Business, Marketing, Political Science",0.3,0.8,Social influence and networking capabilityS (Sensing),"Engineering, Medicine, Accounting",0.6,0.5,Practical fact processing and attention to detailN (Intuition),"Arts, Design, Psychology",0.2,0.7,Abstract thinking and innovation capabilityT (Thinking),"Law, Economics, Engineering",0.8,0.45,Objective analysis and logical decision-makingF (Feeling),"Education, Nursing, Counseling",0.25,0.65,Interpersonal harmony and value-based decision-makingJ (Judging),"Structured majors (Medicine, Law, etc.)",0.9,0.6,Planning and systematic task executionP (Perceiving),"Arts, Design, Media",0.15,0.75,Flexibility and adaptive problem-solving
